{
  "schema_version": "pricing/v1",
  "document_id": "FICTIONAL-PRICING-NOT-A-REAL-PRICE",
  "provenance": {
    "classification": "FICTIONAL",
    "author_role": "CONTRACT_EXAMPLE",
    "source_refs": [
      "FICTIONAL: no recorded market or owner annotation"
    ],
    "notes": "FICTIONAL schema example only; never recognition ground truth."
  },
  "currency": "USD",
  "model": "FICTIONAL-MODEL",
  "effective_at": "2030-01-01T00:00:00Z",
  "source_ref": {
    "path": "FICTIONAL/not-a-real-tape.json",
    "sha256": "0000000000000000000000000000000000000000000000000000000000000000",
    "bytes": 0,
    "origin": "CONSTRUCTED"
  },
  "rate_unit_tokens": 1000000,
  "uncached_input_rate": "0",
  "output_rate": "0",
  "cache_discount_assumed": false,
  "owner_pricing_approval_ref": null,
  "seal": null
}
